<?xml version="1.0" encoding="UTF-8"?>
<xs:schema xmlns:xs="http://www.w3.org/2001/XMLSchema">
    <xs:element name="bond_movies">
        <xs:complexType>
            <xs:sequence>
                <xs:element name="movie" maxOccurs="unbounded">
                    <xs:complexType>
                        <xs:sequence>
                            <xs:element name="title" type="xs:string" />
                            <xs:element  name="bond" type="xs:string" />
                            <xs:element name="bond_girl" type="xs:string" />
                            <xs:element name="regie" type="xs:string" />
                            <xs:element name="year" type="xs:gYear" />
                            <xs:element name="duration" type="durationType"/>
                        </xs:sequence>
                        <xs:attribute name="number" use="required" type="numberType" />
                    </xs:complexType>
                </xs:element>
            </xs:sequence>
            <xs:attribute name="month" type="monthType" use="required" />
            <xs:attribute name="year" type="xs:gYear" use="required" />
        </xs:complexType>
    </xs:element>
    <xs:simpleType name="durationType">
        <xs:restriction base="xs:integer">
            <xs:minInclusive value="0" />
            <xs:maxInclusive value="300"/>
        </xs:restriction>
    </xs:simpleType>
    <xs:simpleType name="numberType">
        <xs:restriction base="xs:string">
            <xs:maxLength value="3"/>
            <xs:pattern value="_\d{2}"/>
        </xs:restriction>
    </xs:simpleType>
    <xs:simpleType name="monthType">
        <xs:restriction base="xs:string">
            <xs:enumeration value="January"/>
            <xs:enumeration value="February"/>
            <xs:enumeration value="March"/>
            <xs:enumeration value="April"/>
            <xs:enumeration value="May"/>
            <xs:enumeration value="June"/>
            <xs:enumeration value="July"/>
            <xs:enumeration value="August"/>
            <xs:enumeration value="September"/>
            <xs:enumeration value="October"/>
            <xs:enumeration value="November"/>
            <xs:enumeration value="December"/>
        </xs:restriction>
    </xs:simpleType>
</xs:schema>